"address_line_1__v","latitude__v","longitude__v","postal_code__v","infusion_chairs__v","infusions_performed__v","npi_num__v","hco_name_cda__v"
"5323 Harry Hines Blvd C57-102","32.812849999999997","-96.838740000000001","75390","","","","UT Southwestern-Cardiology"
"10833 Valley View St Ste 300","33.804659999999998","-118.02927","90630-5051","","","","Premier ACO Physicians Network LLC"
"500 University Dr","40.264490000000002","-76.674539999999993","17033-2360","","","","Penn State Healthcare Partners ACO"
"213 Quarry Rd","37.442529999999998","-122.16875","94304-1416","","","","Neurodiagnostic Labs"
"1935 Medical District Dr","32.80894","-96.836240000000004","75235-7701","","","","Childrens Health System Of Texas"
"1 Medical Center Blvd Fl 9","36.09028","-80.271540000000002","27157","","","","Atrium Health Wake Forest Baptist Pediatric Neurology-Janeway Tower 9"
"675 N St Clair St Ste 14-100","41.894452000000001","-87.622750999999994","60611-5966","","","","Northwestern Medicine Endocrinology"
"7777 Forest Ln Bldg D Ste 1190","32.909619999999997","-96.772310000000004","75230","","","1578883187","Fetal Care Consultants LLC Ste 1190"
"2500 Metrohealth Dr","41.461950000000002","-81.697059999999993","44109-1900","","","","Main Campus Medical Center"
"6624 Fannin St Ste 2250","29.709160000000001","-95.402029999999996","77030-2308","","","","Michele Sartori Office"
"1120 NW 14th St Ste 1366","25.787420000000001","-80.213610000000003","33136-2107","","","","American Malik"
"500 22nd St S Ste 504","33.509369999999997","-86.798730000000006","35233-3110","","","","Alabama Physicians Network LLC ACO"
"3310 Fields South Dr Ste 101","40.07246","-88.308400000000006","61822-3742","","","","Stratum Med ACO"
"8431 Fredericksburg Rd","29.518619999999999","-98.573710000000005","78229-3341","","","","UT Health San Antonio Regional Physicians Network"
"135 E Maxwell St Ste 402 Fl 4","38.042650000000002","-84.500100000000003","40508-2617","","","","Uk Good Samaritan Professional Arts Center"
"4000 Cambridge St","39.054270000000002","-94.608639999999994","66160-8501","","","","The University Of Kansas Hospital Neurology"
"5834 Harbour View Blvd","36.870660000000001","-76.442390000000003","23435-3876","","","","Health Center At Harbour View"
"7609 Preston Rd Ste P4400","33.079700000000003","-96.801490000000001","75024-3448","","","","Endocrinology Plano"
"919 Westfall Rd Ste C210","43.114649999999997","-77.596199999999996","14618-2675","","","","Neuromuscular Electromyography And Nerve Conduction (emg) Lab"
"725 Albany St Ste B Fl 6","42.334670000000003","-71.072310000000002","02118-3549","","","","Boston Medical Center-Gastroenterology"
"10906 W 145th Ter","38.863529999999997","-94.709500000000006","66221-2555","","","","The University Of Kansas Health System"
"450 Clarkson Ave","40.655380000000001","-73.945080000000004","11203-2012","","","","Downstate Health Science University-Department Of Neurology"
"111 Michigan Ave NW","38.927219999999998","-77.014570000000006","20010-2916","","","","Childrens National Medical Center Cardiology"
"3400 Bainbridge Ave","40.880130000000001","-73.878659999999996","10467-2404","","","1346435682","MMC Medical Arts Pavilion"
"750 Welch Rd Ste 325","37.438029999999998","-122.17533","94304-1510","","","","Stanford Department Of Pediatric Cardiology"
"13123 E 16th Ave Bo55","39.692900000000002","-104.7953","80045-7106","","","","The Childrens Hospital Denver Pediatric"
"1830 N Franklin St","39.745249000000001","-104.968322","80218-1128","","","","University Physicians Inc At Saint Joseph Hospital"
"3400 Civic Center Blvd Fl St 8","39.947780000000002","-75.193430000000006","19104-5169","","","","Chop At Penn Medicine Hospital Of The University Of Pennsylvania"
"999 N 92nd St 320","43.041800000000002","-88.026719999999997","53226-4876","","","","Division Of Pediatric Surgery At Medical College Of Wisconsin"
"10903 New Hampshire Ave","39.108319000000002","-77.135411000000005","20993-0002","","","","Food And Drug Administration"
"259 E Erie St Ste 1400","41.893970000000003","-87.620660000000001","60611-3907","","","","Northwestern Medicine Anesthesiology Pain Medicine Center"
"1260 E State Road 205","41.159739999999999","-85.466539999999995","46725-9492","","","1497764450","Parkview Whitley Hospital"
"4301 W Markham St","34.751559999999998","-92.320670000000007","72205-7101","","","1861812455","University Of Arkansas For Medical Sciences"
"125 S 31st St Ste 2000","39.953079000000002","-75.185372999999998","19104-3413","","","","University PA University PA Gene Therapy"
"1001 Blythe Blvd Ste 200","35.205080000000002","-80.83878","28203-5865","","","","Pediatric Surgical Associates PA"
"9834 Genesee Ave Ste 406","32.882967000000001","-117.221293","92037-1216","","","1447215975","Associated Eye Surgeons Medical Group"
"2649 Schoenersville Rd Ste 301","40.645940000000003","-75.407709999999994","18017-7332","","","1467491217","LVPG Cardiology-Muhlenberg"
"3183 W State St","36.593049999999998","-82.23836","37620-1712","","","1962533661","Dermatology Associates-Bristol"
"100 Mario Capecchi Dr","40.764547","-111.84184399999999","84112-8924","","","","Pediatric Neurosurgical Assoc"
"6624 Fannin St Ste 1670","29.709160000000001","-95.402029999999996","77030-2340","","","","Shaibani Aziz MD"
"1 Hospital Dr Rm N601","38.937626000000002","-92.330813000000006","65201-5276","","","","University Of Missouri Columbia"
"95 Wells Ave Ste 320","42.29318","-71.200140000000005","02459-3216","","","1083644017","Mass General Brigham Home Care Inc"
"13123 E 16th Ave","39.742449999999998","-104.83577","80045-7106","","","","Colorado Permanente Medical Group At Childrens Hospital"
"75 Francis St","42.336109999999998","-71.107479999999995","02115-6110","","","","Brigham And Womens Hospital Division Of Plastic And Reconstructive Surgery"
"415 Ray C Hunt Dr","38.025149999999996","-78.526079999999993","22903-2980","","","","Diabetes And Endocrine Clinic"
"500 Bic Dr Ste 200","41.219479999999997","-73.100620000000006","06461-1777","","","1407932056","Home Care Plus Inc"
"1501 N Campbell Ave Rm 3302","32.240490000000001","-110.94607999999999","85724-0001","","","","Upi Vascular Surg 4 Opc"
"75 Francis St","42.336109999999998","-71.107479999999995","02115-6110","","","","Watkins Cardiovascular Clinic"
"1221 Lee St Fl 4","38.031995999999999","-78.498807999999997","22908","","","","University Of Virginia Health Adult Neurology Clinic"
"3333 Burnet Ave","39.140659999999997","-84.501000000000005","45229-3026","","","","Cincinnati Childrens Hospital Medical Center Burnet Campus Neurology Department"
"1959 NE Pacific St","47.650269999999999","-122.30705","98195-0001","","","","Pulmonary Vascular Disease Clinic At Uwmc"
"55 Fruit St Ste 1303","42.36262","-71.068299999999994","02114-2621","","","","Mass General Surgery Burn Center"
"600 Highland Ave","43.077089999999998","-89.429079999999999","53792-0001","","","","University Of Wisconsin School Of Medicine And Public Health-Department Of Pediatrics"
"4921 Parkview Pl Fl 6","38.638311999999999","-90.264843999999997","63110-1032","","","","Washington University Neurology Clinic"
"11140 Montgomery Rd Ste 1300","39.265979999999999","-84.331280000000007","45249-2309","","","","The Christ Hospital Outpatient Center-Montgomery"
"1625 N Campbell Ave","32.24212","-110.94432999999999","85719-4330","","","","Diamond Childrens Medical Center"
"725 Albany St","42.334670000000003","-71.072310000000002","02118-3549","","","","Shapiro Ambulatory Care"
"7789 Southwest Fwy Ste 360","29.69257","-95.524500000000003","77074-1831","","","","Texas Heart Rhythm Center PA-7789 Southwest Houston"
"50 Moisey Dr Ste 103","40.98818","-76.016999999999996","18202-9297","","","","LVPG Cardiology-Health And Wellness Center"
"1221 Lee St Primary Care","38.031609000000003","-78.490548000000004","22908","","","","University Of Virginia Medical Center Neurology Clinic"
"732 Harrison Ave Fl 3","42.337744000000001","-71.071657999999999","02118-2309","","","","Cardiovascular Center At Boston Medical Center"
"700 Childrens Dr","39.952432000000002","-82.978915000000001","43205-2664","","","","Nationwide Childrens Hospital Spinal Muscular Atrophy Center"
"1935 Medical District Dr","32.80894","-96.836240000000004","75235-7701","","","1194743013","Childrens Health Clinical Operations"
"757 Westwood Plz Ste 8501","34.066189999999999","-118.44593999999999","90095-8358","","","","UCLA Cardiovascular And Interventional Radiology Department"
"200 Ucla Medical Plz Ste C365","34.065089999999998","-118.44620999999999","90095-8344","","","","UCLA Cardiac Arrhythmia Center"
"2700 Walker Way","32.644660000000002","-96.883619999999993","75115-2088","","","1184029811","Select Specialty Hospital-Dallas Downtown"
"8300 Floyd Curl Dr","29.515180000000001","-98.580179999999999","78229-3931","","","","Marc Medical Arts Research Center"
"1150 NW 14th St Ste 609","25.787109999999998","-80.213380000000001","33136-2117","","","","University Of Miami Kessenich Family ALS Center"
"1230 Mamaroneck Ave Ste 100","40.991239999999998","-73.746459999999999","10605-5231","","","1801463401","Ageless Mens Health"
"1150 NW 14th St Ste 609","25.787109999999998","-80.213380000000001","33136-2117","","","","University Of Miami ALS Center"
"6651 Main St","29.70871","-95.402720000000002","77030-2351","","","","Legacy Tower"
"175 Hospital Dr","38.012059999999998","-84.216419999999999","40391-9591","","","1811213994","Clark Regional Medical Center"
"6700 West Loop S Ste 400","29.70693","-95.460089999999994","77401-4120","1","Yes/True","1104887751","Neurology Consultants Of Houston PA"
"300 Community Dr","40.777740000000001","-73.701920000000001","11030-3816","","","","CCMC Department Of Pediatrics Division Of Neonatology"
"800 S Church St Ste 104","35.835090000000001","-90.703789999999998","72401-4154","","","","UT Lebonheur Pediatric Specialists Inc"
"10751 Falls Rd Ste 303","39.420439999999999","-76.669550000000001","21093-4551","","","","Kafonek David R MD Office"
"200 Hawkins Dr","41.659061000000001","-91.549909999999997","52242-1009","","","","Uihc Department Of Pediatric Cardiology"
"111 Colchester Ave","44.478760000000001","-73.192530000000005","05401-1473","","","1659309615","The University Of Vermont Medical Center"
"121 Memorial Dr","36.699640000000002","-86.574460000000002","42134-2752","","","","Vanderbilt Childrens Cardiology Franklin Ky"
"1549 Gale Lemerand Dr Fl 2","29.637820000000001","-82.349019999999996","32610-3008","","","","UF Health Center Of Pediatric Neuromuscular And Rare Diseases"
"1020 Hitt St","38.938789999999997","-92.324969999999993","65212-1002","","","","University Of Missouri Healthcare ALS Treatment Center"
"1301 Medical Center Dr Ste B817","36.14076","-86.801860000000005","37232-0028","","","","Vanderbilt Neurodiagnostics Lab"
"937 15th St","33.450637999999998","-82.081363999999994","30912-0008","","","","Augusta University Cardiovascular Center 15th Street"
"1 Blachley Rd","41.051769999999998","-73.516109999999998","06902-0002","","","","HSS Stamford Outpatient Center"
"1100 Dr Martin L King Jr Blvd Ste 1100","36.150908000000001","-86.786128000000005","37203-5749","","","","Healthtrust Performance Group"
"100 Kings Highway S Ste 2500","43.235816","-77.575337000000005","14617-5509","","","","Rochester Regional Health ACO"
"5323 Harry Hines Blvd","32.812480000000001","-96.842209999999994","75390-7208","","","","UT Southwestern Medical Center Admin"
"3601 5th Ave Ste 2B","40.441510000000001","-79.959320000000005","15213-3403","","","","UPMC Arthritis And Autoimmunity Center Admin"
"55 Fruit St","42.362549999999999","-71.069289999999995","02114-2621","","","","Mass General Brigham Massachusetts General Hospital Admin"
"2001 Medical Pkwy","38.990369999999999","-76.533929999999998","21401-3280","","","","Luminis Health"
"1211 Union Ave Ste 965","35.13682","-90.021140000000003","38104","","","","UT Methodist Physicians Cardiology-1211 Union Ste 965"
"3307 Northland Dr Ste 160","30.337039999999998","-97.756602999999998","78731-5050","","","","The National Infusion Center Association"
"20 N Wacker Dr Ste 2030","41.882530000000003","-87.637510000000006","60606-3002","","","","American Society Of Retina Specialists Asrs"
"3211 W Azeele St","27.941389999999998","-82.496110000000002","33609-3017","","","1326740937","Tampa Endocrinology Institute LLC"
"132 Abigail Ln","40.814300000000003","-77.941950000000006","16870-7153","","","1336441039","Universal Community Behavioral Health Inc"
"11104 Parkview Circle Dr Ste 110","41.186059999999998","-85.102080000000001","46845-1673","","","","Parkview Neurosciences"
"191 N Main St","42.122700000000002","-77.950990000000004","14895-1150","","","1720030703","Jones Memorial Hospital"
"11234 Anderson St","34.049480000000003","-117.26366","92350-1716","","","1912929407","Llumc Outpatient Pharmacy"
"55 Fruit St","42.362417999999998","-71.069230000000005","02114-2621","","","","Neurology-Primary Care-Massachusetts General Hospital"
"675 N Saint Clair St","41.894469999999998","-87.622649999999993","60611-5975","","","","Northwestern Vein Center"
"740 S Limestone Ste B101","38.033560000000001","-84.508219999999994","40536","","","","Kentucky Neuroscience Institute Kentucky Clinic"
"751 Medical Center Ct","32.618870000000001","-117.02267000000001","91911-6617","1","Yes/True","1821445479","Sharp Chula Vista Medical Center"
"300 E Market St Ste 490","38.25376","-85.747649999999993","40202-1960","","","","UOFL Physicians-Sleep Center"
"1001 Main St Fl 4","42.901090000000003","-78.868870000000001","14203","","","","UBMD Pediatric Cystic Fibrosis Outpatient Center-Conventus"
"5255 E Stop 11 Rd Ste 430","39.651257000000001","-86.077566000000004","46237-6341","","","","Riley Pediatric Cardiology"
"10 Duke Medicine Cir","36.004607","-78.935878000000002","27710-1000","","","","Duke Cardiovascular Magnetic Resonance (mri) Center"
"2701 W 68th St","41.769440000000003","-87.692310000000006","60629-1813","","","1255471041","SMG At Holy Cross Hospital Pavilion"
"4650 W Sunset Blvd","34.098149999999997","-118.29082","90027-6062","","","","Childrens Heart Center"
"1410 Tusculum Blvd Ste 1500","36.174028","-82.792502999999996","37745-5810","","","","Wellmont Cva Heart Institute-Greeneville"
"541 Main St Ste 210","42.188000000000002","-70.955910000000003","02190-1889","","","","Harbor Medical Associates PC Suite 210"
"4055 Easton Blvd","41.615119999999997","-93.536013999999994","50317-5672","","","","Blank Childrens Developmental Center"
"2801 Blue Ridge Rd G/F","35.818950000000001","-78.705619999999996","27607-0114","","","","UNC Childrens Allergy And Immunology At Raleigh"
"3400 Spruce St Fl 1","39.950029999999998","-75.193039999999996","19104-4229","","","1629181912","Penn Renal Electrolyte And Hypertension Division"
"55 Fruit St","42.36262","-71.068299999999994","02114-2621","","","","MGH For Children Pediatric Cardiology"
"15 Parkman St Ste 720 Fl 7","42.362499999999997","-71.068250000000006","02114-3117","","","","MGH Comprehensive Neurology Division-General Neurology Program"
"222 Piedmont Ave Ste 5300","39.136159999999997","-84.504199999999997","45219","","","1417108697","UC Health Dermatology-Clifton Physicians Office Building"
"601 Elmwood Ave Ste 211","43.122950000000003","-77.623699999999999","14642-0001","","","1932357795","Comprehensive Breast Care At Wilmot Cancer Institute"
"3471 5th Ave","40.440460000000002","-79.960660000000004","15213-3204","","","","UPMC Department Of Orthopedics Surgery"
"433 McAlister Rd","35.490290000000002","-81.203190000000006","28092-4147","","","1326088139","Atrium Health Lincoln"
"505 S Main St Ste 300","33.779890000000002","-117.86633999999999","92868-4523","","","1275975104","Choc Specialists Neurosurgery"
"165 Cambridge St Ste 820","42.361579999999996","-71.06532","02114-2747","","","","MGH Neuropathy Center"
"1675 Highland Ave","43.076360999999999","-89.428963999999993","53792-0002","","","","American Family Childrens Hospital Pediatric Cpap Clinic"
"100 N Mario Capecchi Dr","40.770659999999999","-111.83922","84113-1103","","","","Pediatric Anesthesiologists Inc"
"707 N Broadway","39.298690000000001","-76.593670000000003","21205-1832","","","","Kennedy Krieger Institute Admin"
"6829 N 72nd St Ste 7500","41.321181000000003","-96.023782999999995","68122-1733","","","","CHI Health Clinic Plastic Surgery Immanuel"
"4350 Shawnee Mission Pkwy Ste 2119","39.027949999999997","-94.637370000000004","66205","","","","University Of Kansas Hospital Clinical Research Center"
"3471 5th Ave Ste 810","40.440460000000002","-79.960660000000004","15213-3206","","","","UPMC Department Of Neurology Main Clinic At Kaufmann Medical Building"
"1600 SW Archer Rd Stop 13 Fl 1","29.639800000000001","-82.342709999999997","32610-3003","","","","UF Health Congenital Heart Center"
"355 E Erie St","41.894224000000001","-87.618902000000006","60611-3167","","","1205879095","Shirley Ryan Ability Lab"
"455 Executive Campus Dr","40.138210000000001","-82.950770000000006","43082-8870","","","","NCH Westerville Surgery Center"
"6651 Main St Ste F420","29.70871","-95.402720000000002","77030-2389","","","","Texas Childrens Pavilion For Women"
"154 Hospital Dr Ste 6","40.676000999999999","-78.252663999999996","16686-1829","","","","Nittany Eye"
"11958 W Broad St","37.656255999999999","-77.627701999999999","23233-1007","","","","VCU Health: Neuroscience Orthopedics And Wellness Center"
"8300 Constitution Ave NE","35.093420000000002","-106.55361000000001","87110-7613","","","","Presbyterian Medical Group Kaseman Sleep Disorder Center"
"2106 Harrisburg Pike","40.067030000000003","-76.353669999999994","17601-2644","","","1760803423","Penn Liver Transplant Clinic Lancaster General Health"
"9101 N Central Expy Ste 300","32.872390000000003","-96.771410000000003","75231-5945","","","","Baylor Scott And White Dallas Diagnostic Association-Park Cities"
"7200 Cambridge St Ste 8A","29.69848","-95.394220000000004","77030-4202","","","1245626696","Baylor College Of Medicine-Immunology Allergy Rheumatology"
"711 Kasota Ave SE","44.980159999999998","-93.214340000000007","55414-2842","","Yes/True","1427080415","Fairview Specialty Services Pharmacy"
"10 Center Dr Bldg 10","39.108319000000002","-77.135411000000005","20892-0004","","","","NIH Institute And Center-Clinical Center"
"8260 Atlee Rd","37.628700000000002","-77.38597","23116-1844","","","1366484644","Memorial Regional Medical Center Emergency Department"
"30 E Apple St Ste 6252","39.746029999999998","-84.186989999999994","45409-2939","","","1457382640","Miami Valley Heart And Lung Surgeons LLC"
"3113 Bellevue Ave","39.135890000000003","-84.504469999999998","45219-3158","","","","UC Physicians Neuroscience Institute"
"730 Welch Rd Fl 2","37.437730000000002","-122.17440999999999","94304-1504","","","","Stanford Medicine Neurology And Neurological Sciences-Division Of Child Neurology"
"530 E 74th St","40.76737","-73.951120000000003","10021-3459","","","","David H Koch Center For Cancer Care At Memorial Sloan Kettering Cancer Center"
"4800 Sand Point Way NE Rc.2.820","47.66281","-122.28223","98105-3901","","","","Seattle Childrens-Cardiology-Heart Center"
"330 Brookline Ave","42.339840000000002","-71.105680000000007","02215-5400","","","","BIDMC Department Of Neurology"
"330 Brookline Ave","42.339790000000001","-71.104879999999994","02215-5400","","","","Beth Israel Deaconess Medical Center Radiology"
"30 Worthington Blvd","40.05048","-75.516469999999998","19355-3259","","","","Nemours Childrens Health Malvern"
"50 N Medical Dr","40.772979999999997","-111.83672","84132-0001","","","1588656870","University Of Utah Hospital"
"550 University Blvd","39.775297999999999","-86.175526000000005","46202-5149","","","1861465551","IU Health University Hospital"
"1601 SW Archer Rd","29.63766","-82.3446","32608-1135","","","1063462000","North Florida South Georgia Veterans Health System"
"3400 Wake Forest Rd","35.828749999999999","-78.618229999999997","27609-7317","","","1013916352","Duke Raleigh Hospital"
"1 Clara Maass Dr","40.784329999999997","-74.176220000000001","07109-3550","","","1902901333","Clara Mass Medical Center"
"282 Washington St","41.753680000000003","-72.681870000000004","06106-3322","","","1215947387","Connecticut Childrens Medical Center"
"620 Howard Ave","40.522150000000003","-78.398570000000007","16601-4804","","","1114926953","UPMC Altoona"
"929 N St Francis St","37.70046","-97.331909999999993","67214-3821","","","1154314789","Ascension Via Christi St Francis"
"3643 N Roxboro St","36.036149999999999","-78.899699999999996","27704-2702","","","1871592113","Duke Regional Hospital"
"4420 Lake Boone Trl","35.81561","-78.704059999999998","27607-7505","","","1972807352","UNC Health Rex-Raleigh"
"710 W 168th St Fl 3","40.84207","-73.942480000000003","10032-3726","","","","Neurosurgical Associates Of NY And NJ"
"5880 University Ave","41.599640000000001","-93.788979999999995","50266-8209","","","1629301684","Iowa Heart Center"
"1 Medical Village Dr","39.014919999999996","-84.559839999999994","41017-3403","","","1932187937","St Elizabeth Edgewood"
"6250 S Cottage Grove Ave","41.780670000000001","-87.606560000000002","60637-2530","","","1578560090","Friend Health-Cottage Grove"
"1675 Highland Ave","43.073728000000003","-89.429151000000005","53792-0002","","","","UW Health-American Family Childrens Hospital"
"99 Campus Ave Ste 301","44.101280000000003","-70.19838","04240-6045","","","","Mmp Cardiovascular Surgery"
"7777 Forest Ln Ste C742","32.911459999999998","-96.774479999999997","75230-6862","","","","Fetal Care Consultants LLC Ste C742"
"1221 Lee St Fl 4","38.031995999999999","-78.498807999999997","22908","","","","Adult Neurology Clinic"
"6811 Austin Center Blvd Ste 400","30.350760000000001","-97.750470000000007","78731-3157","","","","Dell Childrens Medical Group"
"7703 Floyd Curl Dr","29.50479","-98.576580000000007","78229-3901","","","","UT Health Joe R And Teresa Lozano Long School Of Medicine"
"10751 Falls Road","39.438634","-76.640096","21093","","","","Johns Hopkins Medicine-Green Spring Station"
"250 Mercy Dr","42.491849999999999","-90.67277","52001-7320","","","","Dubuque-Mercy Drive"
"265 Campus Dr Ste G2103","37.43027","-122.17948","94305-5101","","","","Stanford Cancer Institute Comprehensive Cancer Center"
"622 W 168th St","40.841320000000003","-73.940669999999997","10032-3720","","","1194832477","Newyork-Presbyterian Columbia University Irving Medical Center"
"3800 W Chapman Ave Ste 500","33.788420000000002","-117.89530999999999","92868-1638","","","","University Of California At Irvine Health Neuropsychiatric Center"
"7000 Cardinal Pl","40.108989999999999","-83.120769999999993","43017-1091","","","","Cardinal Health Inc Corporate Office"
"301 E Main St","40.725850000000001","-73.241609999999994","11706-8408","","","","Southside Hospital Department Of Pediatrics Neonatal Perinatal"
"3025 Chemical Rd Ste 100","40.104129999999998","-75.286559999999994","19462-1736","","","","National Comprehensive Cancer Network"
"200 Lothrop St","40.442239999999998","-79.960930000000005","15213-2536","","","","UPMC Department Of Pathology"
"29 Broadway Fl 4","40.7134","-73.996639999999999","10006-3201","","","","Cancer Research Institute-National Headquarters"
"200 Medical Park Blvd","37.183610000000002","-77.361320000000006","23805-9274","","","","Bon Secours Southside Medical Center Emergency Department"
"7703 Floyd Curl Dr Rm 1.422","29.50479","-98.576580000000007","78229-3901","","","1104343276","University Of Texas Health Science Center At San Antonio"
"3440 Torrance Blvd Ste 100","33.837119999999999","-118.34614999999999","90503-5805","","","","Childrens Hospital Los Angeles-Southbay"
"4936 Laverna Rd","39.837730000000001","-89.560659999999999","62707-9797","","","","HSHS ACO LLC"
"2725 S 144th St Ste 212","41.232999999999997","-96.136619999999994","68144-5253","","","1275641904","Orthonebraska Oakview"
"243 Charles St","42.362769999999998","-71.070300000000003","02114-3002","","","1740567049","Massachusetts Eye And Ear Associates North Suburban"
"100 N Mario Capecchi Dr","40.770659999999999","-111.83922","84113-1103","","","1760776223","Primary Childrens Hospital-Salt Lake City"
"2174 N Druid Hills Rd NE","33.831180000000003","-84.333389999999994","30329-3102","","","1558727289","Childrens Healthcare Of Atlanta Center For Advanced Pediatrics"
"989 Route 146","42.870350000000002","-73.812330000000003","12065-3646","","","","Albany Med Community Neurology"
"5601 Arringdon Park Dr Ste 240-410","35.884410000000003","-78.83023","27560-5677","","","","Duke Cardiology Arringdon"
"5028 Wisconsin Ave NW","38.955539999999999","-77.083420000000004","20016-4118","","","","Friendship Heights"
"401 E Chestnut St","38.248089999999998","-85.746740000000003","40202-5700","","","","UOFL Health Chestnut Street Outpatient Center"
"13123 E 16th Ave","39.742449999999998","-104.83577","80045-7106","","","","Childrens Hospital Colorado-Pediatric Cardiology Clinic"
"1370 13th Ave S Ste 215","30.274270000000001","-81.400440000000003","32250-3206","","","1336476795","Baptist Neurology Group"
"4650 W Sunset Blvd","34.09787","-118.29062999999999","90027-6062","","","1003102781","Childrens Hospital Los Angeles Division Of Pediatric Surgery"
"2200 Childrens Way Fl 9","36.138750000000002","-86.801789999999997","37232-0005","","","","Monroe Carell Jr Childrens Hospital At Vanderbilt Childrens Neurology"
"26691 Plaza Ste 130","33.565669999999997","-117.66491000000001","92691-6347","","","","Childrens Hospital Orange County Mission Viejo"
"6651 Main St Ste F320","29.70871","-95.402720000000002","77030-2353","","","","Texas Childrens Hospital The Lester And Sue Smith Legacy Tower"
"2625 W Alameda Ave Ste 322","34.158009999999997","-118.32993999999999","91505-4822","","","","UCLA Burbank Neurology"
"1540 E Hospital Dr Fl 6","42.281829999999999","-83.728030000000004","48109-4000","","","","Pulmonary Clinic At Mott Childrens Hospital"
